<?xml version="1.0" encoding="UTF-8"?>
<resume xmlns="https://schema-resume.org/xml/1.0"
        xmlns:xsi="http://www.w3.org/2001/XMLSchema-instance"
        xsi:schemaLocation="https://schema-resume.org/xml/1.0
                            https://schema-resume.org/xml/1.0/schema-resume.xsd">
  
  <basics>
    <name>Eleanor Fitzwilliam</name>
    <label>Lead DevOps Engineer</label>
    <image>https://avatars.example.co.uk/efitzwilliam.jpg</image>
    <email>e.fitzwilliam@techmail.co.uk</email>
    <phone>+44 7700 900123</phone>
    <url>https://eleanor-fitzwilliam.dev</url>
    <summary>Experienced DevOps engineer with 8+ years building scalable cloud infrastructure. Passionate about automation, infrastructure as code, and fostering collaborative engineering cultures.</summary>
    
    <keyAchievements>
      <item>Reduced infrastructure costs by 38% through automated resource optimization and right-sizing strategies</item>
      <item>Led migration of 50+ microservices to Kubernetes, achieving 99.97% uptime</item>
      <item>Implemented zero-downtime deployment pipeline serving 2M+ daily active users</item>
      <item>Mentored and developed 4 junior engineers who advanced to mid-level positions</item>
      <item>Designed disaster recovery system with 15-minute RTO for financial services platform</item>
      <item>Automated compliance reporting reducing audit preparation time by 75%</item>
    </keyAchievements>
    
    <coreCompetencies>
      <item>Cloud Architecture &amp; Infrastructure Design</item>
      <item>Container Orchestration (Kubernetes, Docker)</item>
      <item>Infrastructure as Code (Terraform, CloudFormation)</item>
      <item>CI/CD Pipeline Development</item>
      <item>Monitoring &amp; Observability</item>
      <item>Security &amp; Compliance Automation</item>
      <item>Team Leadership &amp; Mentoring</item>
      <item>AWS, Azure, GCP Multi-Cloud Expertise</item>
      <item>Python, Go, Bash Scripting</item>
    </coreCompetencies>
    
    <location>
      <streetAddress>42 Kensington Gardens, Flat 3B</streetAddress>
      <postalCode>W2 4RU</postalCode>
      <city>London</city>
      <countryCode>GB</countryCode>
      <region>Greater London</region>
    </location>
    
    <profiles>
      <profile>
        <network>LinkedIn</network>
        <username>eleanor-fitzwilliam</username>
        <url>https://linkedin.com/in/eleanor-fitzwilliam</url>
      </profile>
      <profile>
        <network>GitHub</network>
        <username>efitzdev</username>
        <url>https://github.com/efitzdev</url>
      </profile>
      <profile>
        <network>Twitter</network>
        <username>ellie_devops</username>
        <url>https://twitter.com/ellie_devops</url>
      </profile>
    </profiles>
    
    <nationalities>
      <nationality>
        <country>GB</country>
        <born>true</born>
      </nationality>
    </nationalities>
    
    <workAuthorization>
      <authorization>
        <country>GB</country>
        <status>Citizen</status>
        <rightToWork>true</rightToWork>
      </authorization>
      <authorization>
        <country>IE</country>
        <status>EU Citizen Rights</status>
        <rightToWork>true</rightToWork>
        <notes>Right to work through UK-Ireland Common Travel Area</notes>
      </authorization>
      <authorization>
        <country>US</country>
        <status>Work Visa</status>
        <rightToWork>false</rightToWork>
        <visaType>H-1B Skilled Worker Visa</visaType>
        <validFrom>2023-08-15</validFrom>
        <validTo>2026-08-15</validTo>
      </authorization>
    </workAuthorization>
  </basics>
  
  <work>
    <name>CloudScale Technologies Ltd</name>
    <industry>Cloud Computing &amp; Enterprise Software</industry>
    <location>
      <address>15 Deansgate Square, Suite 400</address>
      <city>Manchester</city>
      <region>Greater Manchester</region>
      <postalCode>M3 1BJ</postalCode>
      <countryCode>GB</countryCode>
      <country>United Kingdom</country>
    </location>
    <workLocation>Manchester, UK</workLocation>
    <contactDetails>
      <email>careers@cloudscale.tech</email>
      <phone>+44 161 123 4567</phone>
      <fax>+44 161 123 4568</fax>
    </contactDetails>
    <description>Enterprise cloud solutions provider</description>
    <position>Lead DevOps Engineer</position>
    <workType>full-time</workType>
    <url>https://cloudscale.tech</url>
    <startDate>2021-06</startDate>
    <summary>Leading a team of 6 engineers in designing and implementing cloud infrastructure for enterprise clients across Europe</summary>
    <highlights>
      <item>Reduced infrastructure costs by 38% through automated resource optimization</item>
      <item>Implemented zero-downtime deployment pipeline serving 2M+ daily users</item>
      <item>Mentored 4 junior engineers who were promoted to mid-level roles</item>
      <item>Migrated legacy monolith to microservices architecture on Kubernetes</item>
    </highlights>
  </work>
  
  <work>
    <name>FinTech Innovations plc</name>
    <industry>Financial Technology</industry>
    <location>
      <address>22 George Street</address>
      <city>Edinburgh</city>
      <region>Scotland</region>
      <postalCode>EH2 2PQ</postalCode>
      <countryCode>GB</countryCode>
      <country>United Kingdom</country>
    </location>
    <workLocation>Edinburgh, Scotland</workLocation>
    <contactDetails>
      <email>info@fintechinnovations.co.uk</email>
      <phone>+44 131 555 7890</phone>
    </contactDetails>
    <description>Financial technology startup</description>
    <position>Senior DevOps Engineer</position>
    <workType>remote</workType>
    <url>https://fintechinnovations.co.uk</url>
    <startDate>2018-03</startDate>
    <endDate>2021-05</endDate>
    <summary>Built and maintained cloud infrastructure for payment processing platform handling £50M+ in daily transactions</summary>
    <highlights>
      <item>Achieved 99.97% uptime across all production services</item>
      <item>Designed disaster recovery system with 15-minute RTO</item>
      <item>Automated compliance reporting reducing audit preparation time by 75%</item>
      <item>Implemented GitOps workflow improving deployment frequency by 400%</item>
    </highlights>
  </work>

  <work>
    <name>Nexora Digital Ltd</name>
    <industry>Software Development &amp; Consulting</industry>
    <location>
      <address>8 Rutland Square</address>
      <city>Edinburgh</city>
      <region>Scotland</region>
      <postalCode>EH1 2AS</postalCode>
      <countryCode>GB</countryCode>
      <country>United Kingdom</country>
    </location>
    <workLocation>Edinburgh, UK</workLocation>
    <description>Product engineering consultancy building platforms for the public sector</description>
    <url>https://nexora-digital.example.com</url>
    <startDate>2012-09</startDate>
    <endDate>2016-01</endDate>
    <summary>Progressed from junior engineer to engineering lead across four years, delivering cloud platforms for government clients</summary>
    <positions>
      <item>
        <position>Junior Software Engineer</position>
        <workType>onsite</workType>
        <startDate>2012-09</startDate>
        <endDate>2013-12</endDate>
        <summary>Delivered backend features for public-sector web applications under senior mentorship</summary>
        <highlights>
          <item>Shipped 30+ production features across three client platforms</item>
          <item>Automated regression test suite cutting manual QA time by 40%</item>
        </highlights>
      </item>
      <item>
        <position>Software Engineer</position>
        <workType>onsite</workType>
        <startDate>2014-01</startDate>
        <endDate>2014-12</endDate>
        <summary>Owned end-to-end delivery of client-facing services and mentored two interns</summary>
        <highlights>
          <item>Led migration of a monolith to a service-oriented architecture</item>
          <item>Introduced infrastructure-as-code reducing environment setup from days to hours</item>
        </highlights>
      </item>
      <item>
        <position>Senior Software Engineer</position>
        <workType>hybrid</workType>
        <startDate>2015-01</startDate>
        <endDate>2016-01</endDate>
        <summary>Led a team of four engineers and set technical direction for the cloud platform practice</summary>
        <highlights>
          <item>Designed a multi-tenant platform serving 12 government departments</item>
          <item>Mentored four engineers, two of whom were promoted to senior roles</item>
        </highlights>
      </item>
    </positions>
  </work>

  <volunteer>
    <organization>Code Club UK</organization>
    <position>Technical Mentor</position>
    <url>https://codeclub.org.uk</url>
    <startDate>2019-09</startDate>
    <summary>Teaching programming fundamentals to children aged 9-13 at local community centre</summary>
    <highlights>
      <item>Delivered weekly coding sessions to 25+ students</item>
      <item>Developed curriculum materials for Python and web development</item>
      <item>Helped 12 students complete their first software projects</item>
    </highlights>
  </volunteer>
  
  <education>
    <institution>University of Edinburgh</institution>
    <url>https://ed.ac.uk</url>
    <area>Computer Science</area>
    <studyType>Bachelor of Science (Honours)</studyType>
    <degree>BSc (Hons) Computer Science</degree>
    <description>Focused on distributed systems, cloud computing, and software engineering. Completed final year dissertation on microservices architecture patterns.</description>
    <startDate>2012-09</startDate>
    <endDate>2016-06</endDate>
    <score>First Class Honours (78%)</score>
    <gpa>3.9/4.0</gpa>
    <location>Edinburgh, Scotland</location>
    <country>GB</country>
    <courses>
      <item>CS3102 - Distributed Systems</item>
      <item>CS4103 - Cloud Computing Architecture</item>